{
  "$schema": "https://json-schema.org/draft/2020-12/schema",
  "$id": "https://job-pipeline.local/schemas/company-research-bundle-0.1.0.json",
  "title": "Company Research Bundle 0.1.0",
  "type": "object",
  "additionalProperties": false,
  "required": [
    "schema_version", "company_id", "display_name", "aliases",
    "official_domains", "researched_at", "sources", "facts", "signals"
  ],
  "properties": {
    "schema_version": {"const": "0.1.0"},
    "company_id": {"$ref": "#/$defs/id"},
    "display_name": {"$ref": "#/$defs/nonempty"},
    "aliases": {
      "type": "array", "items": {"$ref": "#/$defs/nonempty"}, "uniqueItems": true
    },
    "official_domains": {
      "type": "array", "minItems": 1, "uniqueItems": true,
      "items": {"type": "string", "pattern": "^[a-z0-9.-]+$"}
    },
    "researched_at": {"$ref": "#/$defs/utc"},
    "sources": {
      "type": "array", "minItems": 1, "items": {"$ref": "#/$defs/source"}
    },
    "facts": {
      "type": "array", "minItems": 1, "items": {"$ref": "#/$defs/fact"}
    },
    "signals": {
      "type": "array", "minItems": 1, "items": {"$ref": "#/$defs/signal"}
    }
  },
  "$defs": {
    "id": {"type": "string", "pattern": "^[a-z][a-z0-9_]*$"},
    "nonempty": {"type": "string", "minLength": 1, "pattern": "\\S"},
    "utc": {
      "type": "string",
      "pattern": "^[0-9]{4}-[0-9]{2}-[0-9]{2}T[0-9]{2}:[0-9]{2}:[0-9]{2}Z$"
    },
    "scope": {
      "type": "object",
      "additionalProperties": false,
      "required": ["kind", "name"],
      "properties": {
        "kind": {"enum": ["company", "business_unit", "role_family"]},
        "name": {"$ref": "#/$defs/nonempty"}
      }
    },
    "source": {
      "type": "object",
      "additionalProperties": false,
      "required": [
        "id", "url", "title", "source_kind", "scope", "retrieved_at",
        "snapshot_file", "content_sha256"
      ],
      "properties": {
        "id": {"$ref": "#/$defs/id"},
        "url": {"type": "string", "pattern": "^https://"},
        "title": {"$ref": "#/$defs/nonempty"},
        "source_kind": {
          "enum": [
            "official_company", "official_product", "official_engineering",
            "official_careers", "official_hiring_guide", "verified_dataset"
          ]
        },
        "scope": {"$ref": "#/$defs/scope"},
        "retrieved_at": {"$ref": "#/$defs/utc"},
        "snapshot_file": {"type": "string", "pattern": "^sources/[a-z][a-z0-9_]*\\.txt$"},
        "content_sha256": {"type": "string", "pattern": "^[0-9a-f]{64}$"}
      }
    },
    "fact": {
      "type": "object",
      "additionalProperties": false,
      "required": ["id", "kind", "scope", "claim", "quote", "source_id"],
      "properties": {
        "id": {"$ref": "#/$defs/id"},
        "kind": {
          "enum": [
            "identity", "industry", "product", "domain", "engineering_theme",
            "value", "hiring_guidance", "ats"
          ]
        },
        "scope": {"$ref": "#/$defs/scope"},
        "claim": {"$ref": "#/$defs/nonempty"},
        "quote": {"$ref": "#/$defs/nonempty"},
        "source_id": {"$ref": "#/$defs/id"}
      }
    },
    "signal": {
      "type": "object",
      "additionalProperties": false,
      "required": ["id", "text", "basis_fact_ids", "permitted_uses"],
      "properties": {
        "id": {"$ref": "#/$defs/id"},
        "text": {"$ref": "#/$defs/nonempty"},
        "basis_fact_ids": {
          "type": "array", "minItems": 1, "uniqueItems": true,
          "items": {"$ref": "#/$defs/id"}
        },
        "permitted_uses": {
          "type": "array", "minItems": 1, "uniqueItems": true,
          "items": {"enum": ["s0", "s2_tiebreak", "g3_advisory"]}
        }
      }
    }
  }
}
